{
  "schema_version": "eron-policy-source-catalog-v1",
  "catalog_version": "1.2",
  "snapshot_at": "2026-08-25",
  "active_source_versions": {
    "S01": "S01",
    "S02": "S02-R2",
    "S03": "S03",
    "S04": "S04",
    "S05": "S05",
    "S06": "S06",
    "S07": "S07",
    "T01": "T01",
    "T02": "T02",
    "T03": "T03",
    "T04": "T04",
    "P01": "P01",
    "P02": "P02"
  },
  "rule_source_map": {
    "G01": ["P01", "S01", "S03", "S04", "S05"],
    "G02": ["P01", "S01", "S04"],
    "G03": ["P01", "S03", "S04", "S05"],
    "G04": ["P01", "S04", "S07"],
    "G05": ["P01", "S03", "S04", "S07"],
    "G06": ["P01", "S01", "S02-R2", "S03", "S04"],
    "G07": ["P01", "S01", "S04"],
    "G08": ["P01", "S01", "S03", "S04", "S05"],
    "G09": ["P01", "S01", "S03", "S04"],
    "G10": ["P01", "S01", "S02-R2", "S03", "S04"],
    "G11": ["P01", "S03", "S04"],
    "G12": ["P01", "S01", "S03"],
    "G13": ["P01", "S03", "S04", "S07"],
    "G14": ["P01", "S03", "S04"],
    "G15": ["P01", "S03", "S04", "S05", "S07"],
    "G16": ["P01", "S06"],
    "G17": ["P01", "S06"],
    "G18": ["P01", "S04", "S06", "S07"],
    "G19": ["P01", "S04", "S07"],
    "G20": ["P01", "S01", "S04", "S07"]
  },
  "documents": [
    {
      "source_id": "S01",
      "source_family_id": "S01",
      "title": "의료법 제22조(진료기록부 등)",
      "document_type": "OFFICIAL_LAW",
      "usage_scope": "RUNTIME_VALIDATION",
      "jurisdiction": "KR",
      "published_at": null,
      "snapshot_at": "2026-08-25",
      "source_path": "02_official_sources/S01_Medical_Service_Act_Article_22.html",
      "source_url": "https://www.law.go.kr/lsLinkCommonInfo.do?chrClsCd=010202&lsJoLnkSeq=1031169439",
      "document_hash": "sha256:41524d5e310bbce25bb8e22051069a9259d6f0737cc174b88938d2e279ed8b2c",
      "basis_type": "OFFICIAL_LAW",
      "rule_ids": ["G01", "G02", "G06", "G07", "G08", "G09", "G10", "G12", "G20"],
      "supersedes_source_id": null
    },
    {
      "source_id": "S02",
      "source_family_id": "S02",
      "title": "의료법 시행규칙 제14조(진료기록부 등의 기재 사항)",
      "document_type": "OFFICIAL_LAW",
      "usage_scope": "RUNTIME_VALIDATION",
      "jurisdiction": "KR",
      "published_at": null,
      "snapshot_at": "2026-08-25",
      "source_path": "02_official_sources/S02_Enforcement_Rule_Article_14.html",
      "source_url": "https://www.law.go.kr/LSW/lsInfoP.do?lsiSeq=286963",
      "document_hash": "sha256:917e578a77cf4638a1663347b400bdb10d66e93e714761dfb25f8eb37e2726b2",
      "basis_type": "OFFICIAL_LAW",
      "rule_ids": ["G06", "G10"],
      "supersedes_source_id": null
    },
    {
      "source_id": "S02-R2",
      "source_family_id": "S02",
      "title": "의료법 시행규칙 제14조(진료기록부 등의 기재 사항)",
      "document_type": "OFFICIAL_LAW",
      "usage_scope": "RUNTIME_VALIDATION",
      "jurisdiction": "KR",
      "published_at": "2026-06-12",
      "snapshot_at": "2026-08-25",
      "source_path": "02_official_sources/S02-R2_Enforcement_Rule_Article_14.html",
      "source_url": "https://www.law.go.kr/lsLinkProc.do?chrClsCd=010202&datClsCd=010102&gubun=admRul&joNo=001400000&lsId=56387&mode=10",
      "document_hash": "sha256:0606050d822e7214220dd6c32d5d2cfd725bcf1049da486a4cf1f16fd987e429",
      "basis_type": "OFFICIAL_LAW",
      "rule_ids": ["G06", "G10"],
      "supersedes_source_id": "S02"
    },
    {
      "source_id": "S03",
      "source_family_id": "S03",
      "title": "생성형 인공지능 의료기기 허가·심사 가이드라인",
      "document_type": "OFFICIAL_GUIDELINE",
      "usage_scope": "MEDICAL_DEVICE_ONLY",
      "jurisdiction": "KR",
      "published_at": null,
      "snapshot_at": "2026-08-25",
      "source_path": "02_official_sources/S03_MFDS_Generative_AI_Medical_Device_Guideline.pdf",
      "source_url": "https://www.mfds.go.kr/brd/m_1060/view.do?seq=15628",
      "document_hash": "sha256:89c13db3c9e32601968297056a0633759a81807e4a9a901d43c62e999c213261",
      "basis_type": "OFFICIAL_PRINCIPLE",
      "rule_ids": ["G01", "G03", "G05", "G06", "G08", "G09", "G10", "G11", "G12", "G13", "G14", "G15"],
      "supersedes_source_id": null
    },
    {
      "source_id": "S04",
      "source_family_id": "S04",
      "title": "WHO Ethics and governance of AI for health",
      "document_type": "INTERNATIONAL_GUIDELINE",
      "usage_scope": "RUNTIME_VALIDATION",
      "jurisdiction": "INTERNATIONAL",
      "published_at": null,
      "snapshot_at": "2026-08-25",
      "source_path": "02_official_sources/S04_WHO_Ethics_and_Governance_of_AI_for_Health.pdf",
      "source_url": "https://www.who.int/publications/i/item/9789240037403",
      "document_hash": "sha256:571fc7fba2e3da13bfbb1e690abcaef21e76bfed160c08364095f3d26a0b990d",
      "basis_type": "OFFICIAL_PRINCIPLE",
      "rule_ids": ["G01", "G02", "G03", "G04", "G05", "G06", "G07", "G08", "G09", "G10", "G11", "G13", "G14", "G15", "G18", "G19", "G20"],
      "supersedes_source_id": null
    },
    {
      "source_id": "S05",
      "source_family_id": "S05",
      "title": "WHO Guidance on large multi-modal models",
      "document_type": "INTERNATIONAL_GUIDELINE",
      "usage_scope": "RUNTIME_VALIDATION",
      "jurisdiction": "INTERNATIONAL",
      "published_at": null,
      "snapshot_at": "2026-08-25",
      "source_path": "02_official_sources/S05_WHO_Large_Multimodal_Models_Guidance.pdf",
      "source_url": "https://www.who.int/publications/i/item/9789240084759",
      "document_hash": "sha256:b85c025219cc483f1e05427290660f7c6cffc7830bf2e9f5af46e4045e011d41",
      "basis_type": "OFFICIAL_PRINCIPLE",
      "rule_ids": ["G01", "G03", "G08", "G15"],
      "supersedes_source_id": null
    },
    {
      "source_id": "S06",
      "source_family_id": "S06",
      "title": "MIMIC-IV-ED v2.2",
      "document_type": "DATA_SPECIFICATION",
      "usage_scope": "OFFLINE_EVALUATION",
      "jurisdiction": "INTERNATIONAL",
      "published_at": null,
      "snapshot_at": "2026-08-25",
      "source_path": "02_official_sources/S06_MIMIC_IV_ED_v2_2.html",
      "source_url": "https://physionet.org/content/mimic-iv-ed/2.2/",
      "document_hash": "sha256:ffea5d741eea99637bff5c4a5b9c5c42a57bd9881a4808082d2bceafd2f9f939",
      "basis_type": "DATA_SPECIFICATION",
      "rule_ids": ["G16", "G17", "G18"],
      "supersedes_source_id": null
    },
    {
      "source_id": "S07",
      "source_family_id": "S07",
      "title": "Transparency for Machine Learning-Enabled Medical Devices: Guiding Principles",
      "document_type": "INTERNATIONAL_GUIDELINE",
      "usage_scope": "MEDICAL_DEVICE_ONLY",
      "jurisdiction": "MULTINATIONAL",
      "published_at": "2024-06",
      "snapshot_at": "2026-08-25",
      "source_path": "02_official_sources/S07_FDA_Transparency_ML_Medical_Devices.pdf",
      "source_url": "https://www.fda.gov/media/179269/download",
      "document_hash": "sha256:55fb0b5d83b8ef618a484e653085358f6fbe5784d000d3513878f47d04d95323",
      "basis_type": "OFFICIAL_PRINCIPLE",
      "rule_ids": ["G04", "G05", "G13", "G15", "G18", "G19", "G20"],
      "supersedes_source_id": null
    },
    {
      "source_id": "T01",
      "source_family_id": "T01",
      "title": "OpenAI Whisper decoding defaults",
      "document_type": "TECHNICAL_REFERENCE",
      "usage_scope": "OFFLINE_EVALUATION",
      "jurisdiction": "GLOBAL",
      "published_at": null,
      "snapshot_at": "2026-08-25",
      "source_path": "03_technical_references/T01_OpenAI_Whisper_Decoding_Defaults.html",
      "source_url": "https://github.com/openai/whisper/discussions/2050",
      "document_hash": "sha256:5176db948fb24888ba56463d36997e51ab2fd96464980bcf79f259a6e6ac4d08",
      "basis_type": "TECHNICAL_REFERENCE",
      "rule_ids": [],
      "supersedes_source_id": null
    },
    {
      "source_id": "T02",
      "source_family_id": "T02",
      "title": "faster-whisper README",
      "document_type": "TECHNICAL_REFERENCE",
      "usage_scope": "OFFLINE_EVALUATION",
      "jurisdiction": "GLOBAL",
      "published_at": null,
      "snapshot_at": "2026-08-25",
      "source_path": "03_technical_references/T02_faster_whisper_README.html",
      "source_url": "https://github.com/SYSTRAN/faster-whisper/blob/master/README.md",
      "document_hash": "sha256:a3afcdb14a122c3a448ddea8a2f4df8c26598ced1b6b6be938ed0b476b0bd192",
      "basis_type": "TECHNICAL_REFERENCE",
      "rule_ids": [],
      "supersedes_source_id": null
    },
    {
      "source_id": "T03",
      "source_family_id": "T03",
      "title": "RAGAS Context Precision",
      "document_type": "EVALUATION_REFERENCE",
      "usage_scope": "OFFLINE_EVALUATION",
      "jurisdiction": "GLOBAL",
      "published_at": null,
      "snapshot_at": "2026-08-25",
      "source_path": "03_technical_references/T03_RAGAS_Context_Precision.html",
      "source_url": "https://docs.ragas.io/en/stable/concepts/metrics/available_metrics/context_precision/",
      "document_hash": "sha256:75e16d196cb601ce6bdecbe09d1218e958e585b97f4a37099a92f037df0a972b",
      "basis_type": "TECHNICAL_REFERENCE",
      "rule_ids": [],
      "supersedes_source_id": null
    },
    {
      "source_id": "T04",
      "source_family_id": "T04",
      "title": "DeepEval Faithfulness",
      "document_type": "EVALUATION_REFERENCE",
      "usage_scope": "OFFLINE_EVALUATION",
      "jurisdiction": "GLOBAL",
      "published_at": null,
      "snapshot_at": "2026-08-25",
      "source_path": "03_technical_references/T04_DeepEval_Faithfulness_Source.html",
      "source_url": "https://deepeval.com/docs/metrics-faithfulness",
      "document_hash": "sha256:be968ff38a09c9213fae0abc64e9d2d29993be35a7c2185decad89c1e71854f8",
      "basis_type": "TECHNICAL_REFERENCE",
      "rule_ids": [],
      "supersedes_source_id": null
    },
    {
      "source_id": "P01",
      "source_family_id": "P01",
      "title": "ER:ON Guardrail Rules v1",
      "document_type": "PROJECT_RULESET",
      "usage_scope": "RUNTIME_VALIDATION",
      "jurisdiction": "ERON",
      "published_at": null,
      "snapshot_at": "2026-08-25",